{
  "schemaVersion": "game-factory.golden-corpus/v1",
  "corpusId": "golden-factory-evaluation-corpus-s0-2026-08-28",
  "status": "baseline",
  "cases": [
    {
      "id": "gp-action-reachability-active-vs-idle",
      "schemaVersion": "game-factory.golden-corpus-case/v1",
      "domain": "game-production",
      "failureClass": "action-reachability",
      "varianceFamily": "generic-action-reachability",
      "tier": 1,
      "severity": "standard",
      "sourceKind": "fixture",
      "sourceRefs": ["examples/fixtures/action-reachability/index.html", "factory/src/verify/test-action-reachability.mjs"],
      "expectedOutcome": { "caseResult": "PASS", "systemBehavior": "generic active input reaches the target while the idle control does not" },
      "evidenceRefs": ["PR#22", "workflow:33149427730", "postmerge:33149672153"],
      "seed": true,
      "active": true,
      "notes": "Package 1 seed for game-agnostic bounded directional action reachability."
    },
    {
      "id": "gp-input-causality-autonomous-reject",
      "schemaVersion": "game-factory.golden-corpus-case/v1",
      "domain": "game-production",
      "failureClass": "input-causality",
      "varianceFamily": "input-causality",
      "tier": 1,
      "severity": "critical-integrity",
      "sourceKind": "selftest",
      "sourceRefs": ["examples/fixtures/green/index.html", "factory/src/verify/test-causality-visual.mjs"],
      "expectedOutcome": { "caseResult": "PASS", "systemBehavior": "reject a run whose idle baseline is made indistinguishable from active input" },
      "evidenceRefs": ["postmerge:33168166465"],
      "seed": true,
      "active": true,
      "notes": "Negative control protects against false proof of player causality."
    },
    {
      "id": "gp-visual-fast-terminal-pass",
      "schemaVersion": "game-factory.golden-corpus-case/v1",
      "domain": "game-production",
      "failureClass": "visual-activity-evidence-selection",
      "varianceFamily": "visual-activity",
      "tier": 1,
      "severity": "standard",
      "sourceKind": "fixture",
      "sourceRefs": ["examples/fixtures/fast-success-activity/index.html", "factory/src/verify/test-causality-visual.mjs"],
      "expectedOutcome": { "caseResult": "PASS", "systemBehavior": "accept visible live gameplay activity even when late screenshots show the same static terminal screen" },
      "evidenceRefs": ["PR#27", "workflow:33167837473", "postmerge:33168166465"],
      "seed": true,
      "active": true,
      "notes": "Regression seed for the Harbor terminal-screen visual_activity false-negative failure mode."
    },
    {
      "id": "gp-visual-static-live-reject",
      "schemaVersion": "game-factory.golden-corpus-case/v1",
      "domain": "game-production",
      "failureClass": "visual-activity-evidence-selection",
      "varianceFamily": "visual-activity",
      "tier": 1,
      "severity": "critical-integrity",
      "sourceKind": "fixture",
      "sourceRefs": ["examples/fixtures/static-live/index.html", "factory/src/verify/test-causality-visual.mjs"],
      "expectedOutcome": { "caseResult": "PASS", "systemBehavior": "reject genuinely static live gameplay even when telemetry or input progresses" },
      "evidenceRefs": ["PR#27", "workflow:33167837473", "postmerge:33168166465"],
      "seed": true,
      "active": true,
      "notes": "Negative control keeps the unchanged visual_activity threshold fail-closed."
    },
    {
      "id": "gp-proof-plan-terminal-reachability",
      "schemaVersion": "game-factory.golden-corpus-case/v1",
      "domain": "game-production",
      "failureClass": "proof-plan-reachability",
      "varianceFamily": "terminal-proof-planning",
      "tier": 0,
      "severity": "critical-integrity",
      "sourceKind": "selftest",
      "sourceRefs": ["factory/src/verify/test-proof-reachability.mjs"],
      "expectedOutcome": { "caseResult": "PASS", "systemBehavior": "reject the legacy bounded single-session proof and compile independent reachable success, failure and restart scenarios" },
      "evidenceRefs": ["validated-candidate:candidate-harbor-courier-proof-reachability-20260827"],
      "seed": true,
      "active": true,
      "notes": "Harbor proof-reachability learning represented as deterministic pre-Engineer-spend evidence."
    },
    {
      "id": "gp-terminal-alias-fidelity",
      "schemaVersion": "game-factory.golden-corpus-case/v1",
      "domain": "game-production",
      "failureClass": "terminal-state-semantics",
      "varianceFamily": "terminal-state-vocabulary",
      "tier": 0,
      "severity": "critical-integrity",
      "sourceKind": "selftest",
      "sourceRefs": ["factory/src/verify/test-proof-reachability.mjs", "factory/src/verify/test-fidelity-hardening.mjs"],
      "expectedOutcome": { "caseResult": "PASS", "systemBehavior": "canonicalize only proven terminal aliases such as won/success and gameover/failed/failure while unknown states fail closed" },
      "evidenceRefs": ["PR#20", "validated-candidate:candidate-harbor-courier-terminal-proof-semantics-20260828"],
      "seed": true,
      "active": true,
      "notes": "Terminal vocabulary and Product Fidelity authority share canonical verifier-owned semantics."
    },
    {
      "id": "gp-generated-event-self-attestation-reject",
      "schemaVersion": "game-factory.golden-corpus-case/v1",
      "domain": "game-production",
      "failureClass": "generated-event-self-attestation",
      "varianceFamily": "product-fidelity-evidence-strength",
      "tier": 0,
      "severity": "critical-integrity",
      "sourceKind": "selftest",
      "sourceRefs": ["factory/src/verify/test-fidelity-hardening.mjs"],
      "expectedOutcome": { "caseResult": "PASS", "systemBehavior": "reject a generated gameplay event that occurs without required correlated gameplay progress" },
      "evidenceRefs": ["Package4/5-regression", "postmerge:33163110010"],
      "seed": true,
      "active": true,
      "notes": "Protects Product Fidelity from generated-game self-attestation."
    },
    {
      "id": "gp-full-brief-independent-review",
      "schemaVersion": "game-factory.golden-corpus-case/v1",
      "domain": "game-production",
      "failureClass": "full-brief-fidelity",
      "varianceFamily": "independent-review-evidence",
      "tier": 0,
      "severity": "critical-integrity",
      "sourceKind": "selftest",
      "sourceRefs": ["factory/src/verify/test-fidelity-hardening.mjs", "factory/src/roles/playtester.mjs"],
      "expectedOutcome": { "caseResult": "PASS", "systemBehavior": "require mandatory concrete UN claims to receive independent screenshot or harness evidence and fail closed when the claim fails" },
      "evidenceRefs": ["PR#25", "PR#26", "postmerge:33163110010"],
      "seed": true,
      "active": true,
      "notes": "Packages 4 and 5 seed for full-brief coverage and reviewer evidence independence."
    },
    {
      "id": "gp-owner-heading-context",
      "schemaVersion": "game-factory.golden-corpus-case/v1",
      "domain": "game-production",
      "failureClass": "owner-contract-heading-context",
      "varianceFamily": "owner-brief-decomposition",
      "tier": 0,
      "severity": "critical-integrity",
      "sourceKind": "selftest",
      "sourceRefs": ["factory/src/contract/test-owner-contract.mjs"],
      "expectedOutcome": { "caseResult": "PASS", "systemBehavior": "preserve exact semantic heading context in immutable requirement provenance" },
      "evidenceRefs": ["PR#24", "postmerge:33151905004"],
      "seed": true,
      "active": true,
      "notes": "Package 3 D-4 context-preservation seed."
    },
    {
      "id": "gp-owner-ambiguous-no-inflation",
      "schemaVersion": "game-factory.golden-corpus-case/v1",
      "domain": "game-production",
      "failureClass": "owner-contract-obligation-inflation",
      "varianceFamily": "owner-brief-decomposition",
      "tier": 0,
      "severity": "critical-integrity",
      "sourceKind": "selftest",
      "sourceRefs": ["factory/src/contract/test-owner-contract.mjs"],
      "expectedOutcome": { "caseResult": "PASS", "systemBehavior": "keep ambiguous or optional brief language non-binding and prevent headings from inventing Must-Haves" },
      "evidenceRefs": ["PR#24", "postmerge:33151905004"],
      "seed": true,
      "active": true,
      "notes": "Negative Product Truth control paired with heading-context preservation."
    },
    {
      "id": "fr-repair-signature-jitter-normalization",
      "schemaVersion": "game-factory.golden-corpus-case/v1",
      "domain": "factory-reliability",
      "failureClass": "repair-stagnation-signature",
      "varianceFamily": "repair-convergence",
      "tier": 0,
      "severity": "standard",
      "sourceKind": "selftest",
      "sourceRefs": ["factory/src/control/test-control-reliability.mjs", "factory/src/control/failure-signature.mjs"],
      "expectedOutcome": { "caseResult": "PASS", "systemBehavior": "normalize measurement jitter into the same semantic failure signature" },
      "evidenceRefs": ["PR#23", "postmerge:33150863709"],
      "seed": true,
      "active": true,
      "notes": "Package 2 D-2 seed for stable stagnation detection."
    },
    {
      "id": "fr-runtime-error-signature-distinct",
      "schemaVersion": "game-factory.golden-corpus-case/v1",
      "domain": "factory-reliability",
      "failureClass": "runtime-error-classification",
      "varianceFamily": "repair-convergence",
      "tier": 0,
      "severity": "critical-integrity",
      "sourceKind": "selftest",
      "sourceRefs": ["factory/src/control/test-control-reliability.mjs", "factory/src/control/failure-signature.mjs"],
      "expectedOutcome": { "caseResult": "PASS", "systemBehavior": "keep genuinely different runtime error classes distinct while normalizing irrelevant numeric/path jitter" },
      "evidenceRefs": ["PR#23", "postmerge:33150863709"],
      "seed": true,
      "active": true,